{
  "version": 1,
  "id": "tile-example-safe-fork",
  "tenantId": "t5_example",
  "authorId": "t2_builder",
  "authorName": "routewright",
  "createdAt": "2026-06-25T12:00:00.000Z",
  "updatedAt": "2026-06-25T12:00:00.000Z",
  "width": 18,
  "visualSeed": 1337,
  "status": "draft",
  "lanes": [
    [
      { "terrain": "road", "feature": "none" },
      { "terrain": "road", "feature": "none" },
      { "terrain": "road", "feature": "none" },
      { "terrain": "road", "feature": "none" },
      { "terrain": "road", "feature": "obstacle" },
      { "terrain": "road", "feature": "none" },
      { "terrain": "road", "feature": "none" },
      { "terrain": "road", "feature": "boost" },
      { "terrain": "road", "feature": "none" },
      { "terrain": "road", "feature": "none" },
      { "terrain": "road", "feature": "none" },
      { "terrain": "road", "feature": "parcel" },
      { "terrain": "road", "feature": "none" },
      { "terrain": "road", "feature": "none" },
      { "terrain": "road", "feature": "none" },
      { "terrain": "road", "feature": "none" },
      { "terrain": "road", "feature": "none" },
      { "terrain": "road", "feature": "none" }
    ],
    [
      { "terrain": "road", "feature": "none" },
      { "terrain": "road", "feature": "none" },
      { "terrain": "road", "feature": "none" },
      { "terrain": "road", "feature": "none" },
      { "terrain": "road", "feature": "none" },
      { "terrain": "road", "feature": "none" },
      { "terrain": "road", "feature": "obstacle" },
      { "terrain": "road", "feature": "none" },
      { "terrain": "road", "feature": "none" },
      { "terrain": "road", "feature": "none" },
      { "terrain": "road", "feature": "none" },
      { "terrain": "road", "feature": "none" },
      { "terrain": "road", "feature": "none" },
      { "terrain": "road", "feature": "obstacle" },
      { "terrain": "road", "feature": "none" },
      { "terrain": "road", "feature": "none" },
      { "terrain": "road", "feature": "none" },
      { "terrain": "road", "feature": "none" }
    ],
    [
      { "terrain": "road", "feature": "none" },
      { "terrain": "road", "feature": "none" },
      { "terrain": "road", "feature": "none" },
      { "terrain": "road", "feature": "none" },
      { "terrain": "road", "feature": "none" },
      { "terrain": "road", "feature": "boost" },
      { "terrain": "road", "feature": "none" },
      { "terrain": "gap", "feature": "none" },
      { "terrain": "gap", "feature": "none" },
      { "terrain": "road", "feature": "none" },
      { "terrain": "road", "feature": "parcel" },
      { "terrain": "road", "feature": "none" },
      { "terrain": "road", "feature": "none" },
      { "terrain": "road", "feature": "none" },
      { "terrain": "road", "feature": "none" },
      { "terrain": "road", "feature": "none" },
      { "terrain": "road", "feature": "none" },
      { "terrain": "road", "feature": "none" }
    ]
  ]
}
